{
  "baseline_commit": "0aac58e466d583d0f0436df7b8afa3dc96191263",
  "cases": [
    {
      "expected": {
        "error_type": null,
        "matched": true
      },
      "filter": {
        "type": "transparent"
      },
      "id": "transparent_mt",
      "routable": {
        "connector_id": "abc",
        "destination_addr": {
          "base64": "MjAyMDMwNjA=",
          "length": 8,
          "sha256": "b268acc452a42ed18f8f3713d926564a093f5c5ac8e237726691847a9e73a93d"
        },
        "direction": "mt",
        "group_id": 100,
        "message_payload": null,
        "short_message": {
          "base64": "aGVsbG8gd29ybGQ=",
          "length": 11,
          "sha256": "b94d27b9934d3e08a52e52d7da7dabfac484efe37a5380ee9088f7ace2efcde9"
        },
        "source_addr": {
          "base64": "MjAyMDMwNjA=",
          "length": 8,
          "sha256": "b268acc452a42ed18f8f3713d926564a093f5c5ac8e237726691847a9e73a93d"
        },
        "tags": [],
        "timestamp": "2024-01-15T06:00:00",
        "user_id": 1
      },
      "source": "jasmin/routing/Filters.py"
    },
    {
      "expected": {
        "error_type": null,
        "matched": true
      },
      "filter": {
        "type": "transparent"
      },
      "id": "transparent_mo",
      "routable": {
        "connector_id": "abc",
        "destination_addr": {
          "base64": "MjAyMDMwNjA=",
          "length": 8,
          "sha256": "b268acc452a42ed18f8f3713d926564a093f5c5ac8e237726691847a9e73a93d"
        },
        "direction": "mo",
        "group_id": 100,
        "message_payload": null,
        "short_message": {
          "base64": "aGVsbG8gd29ybGQ=",
          "length": 11,
          "sha256": "b94d27b9934d3e08a52e52d7da7dabfac484efe37a5380ee9088f7ace2efcde9"
        },
        "source_addr": {
          "base64": "MjAyMDMwNjA=",
          "length": 8,
          "sha256": "b268acc452a42ed18f8f3713d926564a093f5c5ac8e237726691847a9e73a93d"
        },
        "tags": [],
        "timestamp": "2024-01-15T06:00:00",
        "user_id": 1
      },
      "source": "jasmin/routing/Filters.py"
    },
    {
      "expected": {
        "error_type": null,
        "matched": true
      },
      "filter": {
        "connector_id": "abc",
        "type": "connector"
      },
      "id": "connector_match",
      "routable": {
        "connector_id": "abc",
        "destination_addr": {
          "base64": "MjAyMDMwNjA=",
          "length": 8,
          "sha256": "b268acc452a42ed18f8f3713d926564a093f5c5ac8e237726691847a9e73a93d"
        },
        "direction": "mt",
        "group_id": 100,
        "message_payload": null,
        "short_message": {
          "base64": "aGVsbG8gd29ybGQ=",
          "length": 11,
          "sha256": "b94d27b9934d3e08a52e52d7da7dabfac484efe37a5380ee9088f7ace2efcde9"
        },
        "source_addr": {
          "base64": "MjAyMDMwNjA=",
          "length": 8,
          "sha256": "b268acc452a42ed18f8f3713d926564a093f5c5ac8e237726691847a9e73a93d"
        },
        "tags": [],
        "timestamp": "2024-01-15T06:00:00",
        "user_id": 1
      },
      "source": "jasmin/routing/Filters.py"
    },
    {
      "expected": {
        "error_type": null,
        "matched": false
      },
      "filter": {
        "connector_id": "other",
        "type": "connector"
      },
      "id": "connector_miss",
      "routable": {
        "connector_id": "abc",
        "destination_addr": {
          "base64": "MjAyMDMwNjA=",
          "length": 8,
          "sha256": "b268acc452a42ed18f8f3713d926564a093f5c5ac8e237726691847a9e73a93d"
        },
        "direction": "mt",
        "group_id": 100,
        "message_payload": null,
        "short_message": {
          "base64": "aGVsbG8gd29ybGQ=",
          "length": 11,
          "sha256": "b94d27b9934d3e08a52e52d7da7dabfac484efe37a5380ee9088f7ace2efcde9"
        },
        "source_addr": {
          "base64": "MjAyMDMwNjA=",
          "length": 8,
          "sha256": "b268acc452a42ed18f8f3713d926564a093f5c5ac8e237726691847a9e73a93d"
        },
        "tags": [],
        "timestamp": "2024-01-15T06:00:00",
        "user_id": 1
      },
      "source": "jasmin/routing/Filters.py"
    },
    {
      "expected": {
        "error_type": null,
        "matched": true
      },
      "filter": {
        "type": "user",
        "user_id": 1
      },
      "id": "user_match",
      "routable": {
        "connector_id": "abc",
        "destination_addr": {
          "base64": "MjAyMDMwNjA=",
          "length": 8,
          "sha256": "b268acc452a42ed18f8f3713d926564a093f5c5ac8e237726691847a9e73a93d"
        },
        "direction": "mt",
        "group_id": 100,
        "message_payload": null,
        "short_message": {
          "base64": "aGVsbG8gd29ybGQ=",
          "length": 11,
          "sha256": "b94d27b9934d3e08a52e52d7da7dabfac484efe37a5380ee9088f7ace2efcde9"
        },
        "source_addr": {
          "base64": "MjAyMDMwNjA=",
          "length": 8,
          "sha256": "b268acc452a42ed18f8f3713d926564a093f5c5ac8e237726691847a9e73a93d"
        },
        "tags": [],
        "timestamp": "2024-01-15T06:00:00",
        "user_id": 1
      },
      "source": "jasmin/routing/Filters.py"
    },
    {
      "expected": {
        "error_type": null,
        "matched": false
      },
      "filter": {
        "type": "user",
        "user_id": 2
      },
      "id": "user_miss",
      "routable": {
        "connector_id": "abc",
        "destination_addr": {
          "base64": "MjAyMDMwNjA=",
          "length": 8,
          "sha256": "b268acc452a42ed18f8f3713d926564a093f5c5ac8e237726691847a9e73a93d"
        },
        "direction": "mt",
        "group_id": 100,
        "message_payload": null,
        "short_message": {
          "base64": "aGVsbG8gd29ybGQ=",
          "length": 11,
          "sha256": "b94d27b9934d3e08a52e52d7da7dabfac484efe37a5380ee9088f7ace2efcde9"
        },
        "source_addr": {
          "base64": "MjAyMDMwNjA=",
          "length": 8,
          "sha256": "b268acc452a42ed18f8f3713d926564a093f5c5ac8e237726691847a9e73a93d"
        },
        "tags": [],
        "timestamp": "2024-01-15T06:00:00",
        "user_id": 1
      },
      "source": "jasmin/routing/Filters.py"
    },
    {
      "expected": {
        "error_type": null,
        "matched": true
      },
      "filter": {
        "group_id": 100,
        "type": "group"
      },
      "id": "group_match",
      "routable": {
        "connector_id": "abc",
        "destination_addr": {
          "base64": "MjAyMDMwNjA=",
          "length": 8,
          "sha256": "b268acc452a42ed18f8f3713d926564a093f5c5ac8e237726691847a9e73a93d"
        },
        "direction": "mt",
        "group_id": 100,
        "message_payload": null,
        "short_message": {
          "base64": "aGVsbG8gd29ybGQ=",
          "length": 11,
          "sha256": "b94d27b9934d3e08a52e52d7da7dabfac484efe37a5380ee9088f7ace2efcde9"
        },
        "source_addr": {
          "base64": "MjAyMDMwNjA=",
          "length": 8,
          "sha256": "b268acc452a42ed18f8f3713d926564a093f5c5ac8e237726691847a9e73a93d"
        },
        "tags": [],
        "timestamp": "2024-01-15T06:00:00",
        "user_id": 1
      },
      "source": "jasmin/routing/Filters.py"
    },
    {
      "expected": {
        "error_type": null,
        "matched": false
      },
      "filter": {
        "group_id": 200,
        "type": "group"
      },
      "id": "group_miss",
      "routable": {
        "connector_id": "abc",
        "destination_addr": {
          "base64": "MjAyMDMwNjA=",
          "length": 8,
          "sha256": "b268acc452a42ed18f8f3713d926564a093f5c5ac8e237726691847a9e73a93d"
        },
        "direction": "mt",
        "group_id": 100,
        "message_payload": null,
        "short_message": {
          "base64": "aGVsbG8gd29ybGQ=",
          "length": 11,
          "sha256": "b94d27b9934d3e08a52e52d7da7dabfac484efe37a5380ee9088f7ace2efcde9"
        },
        "source_addr": {
          "base64": "MjAyMDMwNjA=",
          "length": 8,
          "sha256": "b268acc452a42ed18f8f3713d926564a093f5c5ac8e237726691847a9e73a93d"
        },
        "tags": [],
        "timestamp": "2024-01-15T06:00:00",
        "user_id": 1
      },
      "source": "jasmin/routing/Filters.py"
    },
    {
      "expected": {
        "error_type": null,
        "matched": true
      },
      "filter": {
        "pattern": "^20\\d+0$",
        "type": "source_addr"
      },
      "id": "source_match",
      "routable": {
        "connector_id": "abc",
        "destination_addr": {
          "base64": "MjAyMDMwNjA=",
          "length": 8,
          "sha256": "b268acc452a42ed18f8f3713d926564a093f5c5ac8e237726691847a9e73a93d"
        },
        "direction": "mt",
        "group_id": 100,
        "message_payload": null,
        "short_message": {
          "base64": "aGVsbG8gd29ybGQ=",
          "length": 11,
          "sha256": "b94d27b9934d3e08a52e52d7da7dabfac484efe37a5380ee9088f7ace2efcde9"
        },
        "source_addr": {
          "base64": "MjAyMDMwNjA=",
          "length": 8,
          "sha256": "b268acc452a42ed18f8f3713d926564a093f5c5ac8e237726691847a9e73a93d"
        },
        "tags": [],
        "timestamp": "2024-01-15T06:00:00",
        "user_id": 1
      },
      "source": "jasmin/routing/Filters.py"
    },
    {
      "expected": {
        "error_type": null,
        "matched": false
      },
      "filter": {
        "pattern": "^30\\d+",
        "type": "source_addr"
      },
      "id": "source_miss",
      "routable": {
        "connector_id": "abc",
        "destination_addr": {
          "base64": "MjAyMDMwNjA=",
          "length": 8,
          "sha256": "b268acc452a42ed18f8f3713d926564a093f5c5ac8e237726691847a9e73a93d"
        },
        "direction": "mt",
        "group_id": 100,
        "message_payload": null,
        "short_message": {
          "base64": "aGVsbG8gd29ybGQ=",
          "length": 11,